{
  "kind": "target-instance",
  "schemaVersion": "2.0.0",
  "id": "arithmetic-object-ab",
  "version": "1.0.0",
  "label": "Synthetic arithmetic object ab",
  "equipmentInstanceId": "line-a-motor-ab",
  "semanticDefinitionRef": {
    "id": "arithmetic-model",
    "version": "1.0.0"
  },
  "evidenceRefs": [
    {
      "artifactId": "manual-structure-ab-actual",
      "locator": {
        "kind": "text-line",
        "line": 1
      }
    },
    {
      "artifactId": "manual-structure-ab-target",
      "locator": {
        "kind": "text-line",
        "line": 1
      }
    },
    {
      "artifactId": "manual-arithmetic-ab-gain",
      "locator": {
        "kind": "text-line",
        "line": 1
      }
    }
  ]
}
