{
  "kind": "target-instance",
  "schemaVersion": "2.0.0",
  "id": "arithmetic-object-db",
  "version": "1.0.0",
  "label": "Synthetic arithmetic object db",
  "equipmentInstanceId": "line-a-motor-db",
  "semanticDefinitionRef": {
    "id": "arithmetic-model",
    "version": "1.0.0"
  },
  "evidenceRefs": [
    {
      "artifactId": "manual-structure-db-actual",
      "locator": {
        "kind": "text-line",
        "line": 1
      }
    },
    {
      "artifactId": "manual-structure-db-target",
      "locator": {
        "kind": "text-line",
        "line": 1
      }
    },
    {
      "artifactId": "manual-arithmetic-db-gain",
      "locator": {
        "kind": "text-line",
        "line": 1
      }
    }
  ]
}
